{
  "$id": "https://politicalfingerprint.example/schemas/sample_manifest_v2",
  "$schema": "http://json-schema.org/draft-07/schema#",
  "additionalProperties": false,
  "properties": {
    "artifact_id": {
      "type": "string"
    },
    "benchmark_actions_excluded": {
      "type": "boolean"
    },
    "candidate_batch_content_subject_sha256": {
      "type": "string"
    },
    "candidate_batch_frozen": {
      "type": "boolean"
    },
    "challenge_actions": {
      "items": {
        "additionalProperties": false,
        "properties": {
          "action_id": {
            "type": "string"
          },
          "inclusion_reasons": {
            "items": {
              "type": "string"
            },
            "type": "array"
          },
          "packet_complexity_bytes": {
            "type": "integer"
          }
        },
        "required": [
          "action_id",
          "inclusion_reasons",
          "packet_complexity_bytes"
        ],
        "type": "object"
      },
      "type": "array"
    },
    "challenge_count": {
      "type": "integer"
    },
    "content_subject_sha256": {
      "type": "string"
    },
    "m2_source_readiness_file_sha256": {
      "type": "string"
    },
    "non_authorizing": {
      "type": "boolean"
    },
    "random_population_count": {
      "type": "integer"
    },
    "random_sample_count": {
      "type": "integer"
    },
    "schema_version": {
      "type": "string"
    },
    "seed_input_components": {
      "items": {
        "type": "string"
      },
      "type": "array"
    },
    "seed_sha256": {
      "type": "string"
    },
    "selected_random_action_ids": {
      "items": {
        "type": "string"
      },
      "type": "array"
    },
    "selection_algorithm": {
      "type": "string"
    }
  },
  "required": [
    "artifact_id",
    "benchmark_actions_excluded",
    "candidate_batch_content_subject_sha256",
    "candidate_batch_frozen",
    "challenge_actions",
    "challenge_count",
    "content_subject_sha256",
    "m2_source_readiness_file_sha256",
    "non_authorizing",
    "random_population_count",
    "random_sample_count",
    "schema_version",
    "seed_input_components",
    "seed_sha256",
    "selected_random_action_ids",
    "selection_algorithm"
  ],
  "title": "sample_manifest_v2",
  "type": "object"
}
